"PROBUS","0921-4771","1613-4079","DE GRUYTER MOUTON","GENTHINER STRASSE 13, BERLIN, GERMANY, 10785","English","Language & Linguistics"
"PROCEEDINGS OF THE AMERICAN PHILOSOPHICAL SOCIETY","0003-049X","2326-9243","AMER PHILOSOPHICAL SOC","104 SOUTH FIFTH ST, PHILADELPHIA, USA, PA, 19106-3387","","Humanities, Multidisciplinary"
"PROCEEDINGS OF THE ROYAL IRISH ACADEMY SECTION C-ARCHAEOLOGY CELTIC STUDIES HISTORY LINGUISTICS LITERATURE","0035-8991","2009-0048","ROYAL IRISH ACAD","19 DAWSON STREET, DUBLIN, IRELAND, 2","English","Humanities, Multidisciplinary"
"PROLEGOMENA","1333-4395","1846-0593","SOC ADVANCEMENT PHILOSOPHY-ZAGREB","UNIV ZAGREB-CROATIAN STUDIES, BORONGAJ CAMPUS, BORONGAJSKA CESTA 83D, ZAGREB, CROATIA, HR-10000","English","Philosophy"
"PROOFTEXTS-A JOURNAL OF JEWISH LITERARY HISTORY","0272-9601","1086-3311","INDIANA UNIV PRESS","601 N MORTON STREET, BLOOMINGTON, USA, IN, 47404-3797","English","Literature"
"PROSPETTIVA-RIVISTA DI STORIA DELL ARTE ANTICA E MODERNA","0394-0802","2239-7205","CENTRO DI","VIA DEI RENAI 20/R, FLORENCE, ITALY, 50125","Italian","Art"
"PROSTOR","1330-0652","1333-9117","UNIV ZAGREB FAC ARCHITECTURE","KACICEVA 26, ZAGREB, CROATIA, HR-10000","Croatian","Architecture"
"PROYECTO PROGRESO ARQUITECTURA","2171-6897","2173-1616","UNIV SEVILLA, EDITORIAL","SECRETARIADO PUBLICACIONES, C/ PORVENIR, NO 27, SEVILLE, SPAIN, 41013","English, Spanish","Architecture"
"PSYCHOANALYSIS AND HISTORY","1460-8235","1755-201X","EDINBURGH UNIV PRESS","THE TUN-HOLYROOD RD, 12 2F JACKSONS ENTRY, EDINBURGH, SCOTLAND, EH8 8PJ","English","History"
"PSYCHOLOGY OF AESTHETICS CREATIVITY AND THE ARTS","1931-3896","1931-390X","EDUCATIONAL PUBLISHING FOUNDATION-AMERICAN PSYCHOLOGICAL ASSOC","750 FIRST ST, NE, WASHINGTON, USA, DC, 20002-4242","English","Humanities, Multidisciplinary"
"PSYCHOLOGY OF MUSIC","0305-7356","1741-3087","SAGE PUBLICATIONS INC","2455 TELLER RD, THOUSAND OAKS, USA, CA, 91320","English","Music"
"PSYCHOLOGY OF RELIGION AND SPIRITUALITY","1941-1022","1943-1562","EDUCATIONAL PUBLISHING FOUNDATION-AMERICAN PSYCHOLOGICAL ASSOC","750 FIRST ST, NE, WASHINGTON, USA, DC, 20002-4242","English","Religion"
"PUBLIC ARCHAEOLOGY","1465-5187","1753-5530","ROUTLEDGE JOURNALS, TAYLOR & FRANCIS LTD","2-4 PARK SQUARE, MILTON PARK, ABINGDON, ENGLAND, OXON, OX14 4RN","English","Archaeology"
"PUBLICATIONS OF THE ENGLISH GOETHE SOCIETY","0959-3683","1749-6284","ROUTLEDGE JOURNALS, TAYLOR & FRANCIS LTD","2-4 PARK SQUARE, MILTON PARK, ABINGDON, ENGLAND, OXON, OX14 4RN","Multi-Language","Literature, German, Dutch, Scandinavian"
"PUBLIC CULTURE","0899-2363","1527-8018","DUKE UNIV PRESS","905 W MAIN ST, STE 18-B, DURHAM, USA, NC, 27701","English","Cultural Studies"
"PUBLIC HISTORIAN","0272-3433","1533-8576","UNIV CALIFORNIA PRESS","155 GRAND AVE, SUITE 400, OAKLAND, USA, CA, 94612-3758","English","History"
"PUBLIC UNDERSTANDING OF SCIENCE","0963-6625","1361-6609","SAGE PUBLICATIONS LTD","1 OLIVERS YARD, 55 CITY ROAD, LONDON, ENGLAND, EC1Y 1SP","English","History & Philosophy Of Science"
"PUBLISHING HISTORY","0309-2445","0309-2445","PROQUEST LLC","300 NORTH ZEEB ROAD, ANN ARBOR, USA, MI, 48106-1346","English","History"
"QUADERNI D ITALIANISTICA","0226-8043","0226-8043","QUADERNI D ITALIANISTICA","UNIVERSITY TORONTO DEPT ITALIAN STUDIES, TORONTO, CANADA, ONTARIO, M5S 1A1","Multi-Language","Literature, Romance"
"QUADERNI STORICI","0301-6307","2612-1972","SOC ED IL MULINO","STRADA MAGGIORE 37, BOLOGNA, ITALY, 40125","Italian","History"
"QUADERNI URBINATI DI CULTURA CLASSICA","0033-4987","1724-1901","ACCADEMIA EDITORIALE PISA-ROMA","VIA BETTOLO 6, ROMA, ITALY, 00195","Italian","Classics"
"QUAESTIO ROSSICA","2311-911X","2313-6871","URAL FEDERAL UNIV","PROSPEKT LENINA 51, EKATERINBURG, RUSSIA, 620083","Multi-Language","Humanities, Multidisciplinary"
"QUEENS QUARTERLY","0033-6041","0033-6041","QUEENS QUARTERLY","QUEENS UNIV, KINGSTON, CANADA, ON, K7L 3N6","English","Literary Reviews"
"QUINZAINES-LETTRES ARTS ET IDEES","2650-3794","2677-2507","QUINZAINE LITTERAIRE","135 RUE SAINT-MARTIN, PARIS, FRANCE, 75194","English","Literature"
"RADICAL HISTORY REVIEW","0163-6545","1534-1453","DUKE UNIV PRESS","905 W MAIN ST, STE 18-B, DURHAM, USA, NC, 27701","English","History"
"RADOVI ZAVODA ZA POVIJESNE ZNANOSTI HAZU U ZADRU","1330-0474","1330-0474","HRVATSKA AKAD ZNANOSTI UMJETNOSTI","OBALA KNEZA TRPIMIRA 8, ZADAR, CROATIA, 23000","Croatian","History"
"RAMUS-CRITICAL STUDIES IN GREEK AND ROMAN LITERATURE","0048-671X","2202-932X","CAMBRIDGE UNIV PRESS","EDINBURGH BLDG, SHAFTESBURY RD, CAMBRIDGE, ENGLAND, CB2 8RU","English","Classics"
"RA-REVISTA DE ARQUITECTURA","1138-5596","2254-6332","UNIV NAVARRA, SERVICIO PUBLICACIONES","CAMPUS UNIV, CARRETERA DEL SADAR S-N, APARTADO 177, PAMPLONA, SPAIN, 31080","Spanish","Architecture"
"RARITAN-A QUARTERLY REVIEW","0275-1607","","RARITAN-A QUARTERLY REVIEW","RUTGERS UNIV, 31 MINE ST, NEW BRUNSWICK, USA, NJ, 08903","English","Literary Reviews"
"RASSEGNA DELLA LETTERATURA ITALIANA","0033-9423","","CASA EDITRICE G C SANSONI SPA","LIC SPA, VIA DUCA DI CALABRIA, 1-1, FLORENCE, ITALY, 50125","Italian","Literature, Romance"
"RASSEGNA STORICA DEL RISORGIMENTO","0033-9873","","IST STOR RISORGIMENTO ITAL","VITTORIANO, ROME, ITALY, 00186","","History"
"RATIO","0034-0006","1467-9329","WILEY","111 RIVER ST, HOBOKEN, USA, NJ, 07030-5774","English","Philosophy"
"RECALL","0958-3440","1474-0109","CAMBRIDGE UNIV PRESS","EDINBURGH BLDG, SHAFTESBURY RD, CAMBRIDGE, ENGLAND, CB2 8RU","English","Language & Linguistics"
"RECHERCHES DE THEOLOGIE ET PHILOSOPHIE MEDIEVALES","1370-7493","1783-1717","PEETERS","BONDGENOTENLAAN 153, LEUVEN, BELGIUM, B-3000","French","Medieval & Renaissance Studies | Religion"
"RELIGION","0048-721X","1096-1151","ROUTLEDGE JOURNALS, TAYLOR & FRANCIS LTD","2-4 PARK SQUARE, MILTON PARK, ABINGDON, ENGLAND, OXON, OX14 4RN","English","Religion"
"RELIGION AND AMERICAN CULTURE-A JOURNAL OF INTERPRETATION","1052-1151","1533-8568","CAMBRIDGE UNIV PRESS","EDINBURGH BLDG, SHAFTESBURY RD, CAMBRIDGE, ENGLAND, CB2 8RU","English","History | Religion"
"RELIGION AND THE ARTS","1079-9265","1568-5292","BRILL","PLANTIJNSTRAAT 2, P O BOX 9000, LEIDEN, NETHERLANDS, 2300 PA","English","Religion"
"RELIGION BRAIN & BEHAVIOR","2153-599X","2153-5981","ROUTLEDGE JOURNALS, TAYLOR & FRANCIS LTD","2-4 PARK SQUARE, MILTON PARK, ABINGDON, ENGLAND, OXON, OX14 4RN","English","Religion"
"RELIGION & LITERATURE","0888-3769","2328-6911","UNIV NOTRE DAME","UNIV NOTRE DAME, 1146 FLANNER HALL, NOTRE DAME, USA, IN, 46556","English","Literature | Religion"
"RELIGIONS","","2077-1444","MDPI","ST ALBAN-ANLAGE 66, BASEL, SWITZERLAND, CH-4052","English","Religion"
"RELIGIOUS EDUCATION","0034-4087","1547-3201","TAYLOR & FRANCIS INC","530 WALNUT STREET, STE 850, PHILADELPHIA, USA, PA, 19106","English","Religion"
"RELIGIOUS HUMANISM","0034-4095","","HUUMANISTS ASSOC","PO BOX 185202, HAMDEN, USA, CT, 06518-0202","","Religion"
"RELIGIOUS STUDIES","0034-4125","1469-901X","CAMBRIDGE UNIV PRESS","32 AVENUE OF THE AMERICAS, NEW YORK, USA, NY, 10013-2473","English","Religion"
"RELIGIOUS STUDIES REVIEW","0319-485X","1748-0922","WILEY","111 RIVER ST, HOBOKEN, USA, NJ, 07030-5774","English","Religion"
"RENAISSANCE AND REFORMATION","0034-429X","0034-429X","RENAISSANCE AND REFORMATION","C/O CRRS, 71 QUEENS PARK CRESCENT EAST, TORONTO, CANADA, ON, M5S 1K7","Multi-Language","Medieval & Renaissance Studies"
"RENAISSANCE QUARTERLY","0034-4338","1935-0236","CAMBRIDGE UNIV PRESS","EDINBURGH BLDG, SHAFTESBURY RD, CAMBRIDGE, ENGLAND, CB2 8RU","English","Medieval & Renaissance Studies"
"RENAISSANCE STUDIES","0269-1213","1477-4658","WILEY","111 RIVER ST, HOBOKEN, USA, NJ, 07030-5774","English","Medieval & Renaissance Studies"
"RENASCENCE-ESSAYS ON VALUES IN LITERATURE","0034-4346","2329-8626","MARQUETTE UNIV PRESS","BROOKS HALL, 200, PO BOX 1881, MILWAUKEE, USA, WI, 53201-1881","English","Literature"
"REPRESENTATIONS","0734-6018","1533-855X","UNIV CALIFORNIA PRESS","155 GRAND AVE, SUITE 400, OAKLAND, USA, CA, 94612-3758","English","Cultural Studies"
"RESEARCH IN AFRICAN LITERATURES","0034-5210","1527-2044","INDIANA UNIV PRESS","601 N MORTON STREET, BLOOMINGTON, USA, IN, 47404-3797","Multi-Language","Literature, African, Australian, Canadian"
"RESEARCH IN DANCE EDUCATION","1464-7893","1470-1111","ROUTLEDGE JOURNALS, TAYLOR & FRANCIS LTD","2-4 PARK SQUARE, MILTON PARK, ABINGDON, ENGLAND, OXON, OX14 4RN","English","Dance"
"RESEARCH IN PHENOMENOLOGY","0085-5553","1569-1640","BRILL","PLANTIJNSTRAAT 2, P O BOX 9000, LEIDEN, NETHERLANDS, 2300 PA","English","Philosophy"
"RESONANCIAS","0717-3474","0719-5702","PONTIFICIA UNIV CATOLICA CHILE","AVENIDA VICUNA MACKENNA 4860, MACUL, SANTIAGO, CHILE, 00000","Spanish","Music"
"RESOURCES FOR AMERICAN LITERARY STUDY","0048-7384","0048-7384","PENN STATE UNIV PRESS","820 NORTH UNIV DRIVE, U S B 1, STE C, UNIVERSITY PK, USA, PA, 16802","English","Literature, American"
"RES PHILOSOPHICA","2168-9105","2168-9113","PHILOSOPHY DOCUMENTATION CENTER","PO BOX 7147, CHARLOTTESVILLE, USA, VA, 22906-7147","English","Philosophy"
"RES PUBLICA-A JOURNAL OF MORAL LEGAL AND POLITICAL PHILOSOPHY","1356-4765","1572-8692","SPRINGER","VAN GODEWIJCKSTRAAT 30, DORDRECHT, NETHERLANDS, 3311 GZ","English","Philosophy"
"RETHINKING HISTORY","1364-2529","1470-1154","ROUTLEDGE JOURNALS, TAYLOR & FRANCIS LTD","2-4 PARK SQUARE, MILTON PARK, ABINGDON, ENGLAND, OXON, OX14 4RN","English","History"
"RETI MEDIEVALI RIVISTA","1593-2214","1593-2214","FIRENZE UNIV PRESS","JOURNALS DIVISION, BORGO ALBIZI, 28, FIRENZE, ITALY, 50122","English, French, German, Italian, Portuguese, Spanish","Medieval & Renaissance Studies"
"REVIEW-LITERATURE AND ARTS OF THE AMERICAS","0890-5762","1743-0666","ROUTLEDGE JOURNALS, TAYLOR & FRANCIS LTD","2-4 PARK SQUARE, MILTON PARK, ABINGDON, ENGLAND, OXON, OX14 4RN","English","Literary Reviews"
"REVIEW OF COGNITIVE LINGUISTICS","1877-9751","1877-976X","JOHN BENJAMINS PUBLISHING CO","PO BOX 36224, AMSTERDAM, NETHERLANDS, 1020 ME","English","Language & Linguistics"
"REVIEW OF ENGLISH STUDIES","0034-6551","1471-6968","OXFORD UNIV PRESS","GREAT CLARENDON ST, OXFORD, ENGLAND, OX2 6DP","English","Literature"
"REVIEW OF FAITH & INTERNATIONAL AFFAIRS","1557-0274","1931-7743","ROUTLEDGE JOURNALS, TAYLOR & FRANCIS LTD","2-4 PARK SQUARE, MILTON PARK, ABINGDON, ENGLAND, OXON, OX14 4RN","English","Religion"
"REVIEW OF METAPHYSICS","0034-6632","2154-1302","PHILOSOPHY EDUCATION SOC, INC","223 AQUINAS HALL, CATHOLIC UNIV AMERICA, WASHINGTON, United States, DC, 20064","English","Philosophy"
"REVIEW OF RELIGIOUS RESEARCH","0034-673X","2211-4866","SAGE PUBLICATIONS INC","2455 TELLER RD, THOUSAND OAKS, USA, CA, 91320","English","Religion"
"REVIEW OF SYMBOLIC LOGIC","1755-0203","1755-0211","CAMBRIDGE UNIV PRESS","32 AVENUE OF THE AMERICAS, NEW YORK, USA, NY, 10013-2473","English","Philosophy"
"REVIEWS IN AMERICAN HISTORY","0048-7511","1080-6628","JOHNS HOPKINS UNIV PRESS","JOURNALS PUBLISHING DIVISION, 2715 NORTH CHARLES ST, BALTIMORE, USA, MD, 21218-4363","English","History"
"REVISTA 180","0718-2309","0718-2309","UNIV DIEGO PORTALES","REPUBLICA 180, SANTIAGO, CHILE, 00000","Spanish","Architecture"
"REVISTA BRASILEIRA DE HISTORIA","0102-0188","1806-9347","ASSOC NAC HISTORIA-ANPUH","CIDADE UNIV, AV PROF LINEU PRESTES, 338, CAIXA POSTAL 8105, SAO PAULO SP, BRAZIL, 05508-900","Portuguese, English, Spanish","History"
"REVISTA CHILENA DE LITERATURA","0718-2295","0718-2295","UNIV CHILE, FAC FILOS HUMAN EDUC","CENTRO ESTGRIEGOS BIZANTINOS Y NEOHELENICOS, IGNACIO CARRERA PINTO 1025, CASILLA 73 SUC GRECIA NUNOA, SANTIAGO, CHILE, 00000","Spanish","Literature, Romance"
"REVISTA DE ESTUDIOS HISPANICOS","0034-818X","0034-818X","REVISTA DE ESTUDIOS HISPANICOS","WASHINGTON UNIV, BOX 1077, DEPT ROMANCE LANG, ONE BROOKINGS DR, ST LOUIS, USA, MO, 63130-4899","Multi-Language","Literature, Romance"
"REVISTA DE ETNOGRAFIE SI FOLCLOR-JOURNAL OF ETHNOGRAPHY AND FOLKLORE","0034-8198","0034-8198","EDITURA ACAD ROMANE","CALEA 13 SEPTEMBRIE NR 13, SECTOR 5, BUCURESTI, ROMANIA, 050711","Multi-Language","Folklore"
"REVISTA DE FILOLOGIA ESPANOLA","0210-9174","1988-8538","CONSEJO SUPERIOR INVESTIGACIONES CIENTIFICAS-CSIC","Editorial CSIC, C/VITRUVIO 8, MADRID, Spain, 28006","Spanish","Language & Linguistics | Literature, Romance"
"REVISTA DE FILOSOFIA","0034-8236","0718-4360","UNIV CHILE, FAC FILOSOFIA & HUMANIDADES","DEPT LINGUISTICA, AV CAPITAN IGNACIO CARRERA PINTO 1025, CUARTO PISO, NUNOA, SANTIAGO, CHILE, 00000","Spanish","Philosophy"
"REVISTA DE FILOSOFIA AURORA","0104-4443","1980-5934","PONTIFICIA UNIV CATOLICA PARANA","RUA IMACULADA CONCEICAO 1155, PRADO VELHO, CAIXA POSTAL 16.210, CURITIBA, BRAZIL, PARANA, CEP 80.215-9","Portuguese, Spanish","Philosophy"
"REVISTA DE HISPANISMO FILOSOFICO","1136-8071","1136-8071","FONDO CULTURA ECONOMICA ESPANA S L","VIA POBLADOS, 17-EDIF INDUBUILDING-GOICO, 4-15, MADRID, SPAIN, 28033","Spanish","Philosophy"
"REVISTA DE HISTORIA DA SOCIEDADE E DA CULTURA","1645-2259","2183-8615","UNIV COIMBRA, FAC LETRAS","CENTRO HIST SOCIEDADE, LARGO PORTA FERREA, COIMBRA, PORTUGAL, 3004-530","Portuguese","History"
"REVISTA DE HISTORIA INDUSTRIAL","1132-7200","2385-3247","UNIV BARCELONA, DEPT HISTORIA, INST ECONOMIQUES","AVDA DIAGONAL 690, BARCELONA, SPAIN, 08034","Multi-Language","History"
"REVISTA DE INDIAS","0034-8341","1988-3188","CONSEJO SUPERIOR INVESTIGACIONES CIENTIFICAS-CSIC","Editorial CSIC, C/VITRUVIO 8, MADRID, Spain, 28006","Spanish, English, French, Portuguese","History"
"REVISTA DE LETRAS","0101-3505","1981-7886","UNIV ESTADUAL PAULISTA-UNESP","FAC CIENCIAS LETRAS, CAMPUS DE ARARAQUARA, DEPT LETRAS MODERNAS,, ARARAQUARA, BRAZIL, SP, 14800-901","Portuguese","Literary Theory & Criticism"
"REVISTA DE LITERATURA","0034-849X","1988-4192","CONSEJO SUPERIOR INVESTIGACIONES CIENTIFICAS-CSIC","Editorial CSIC, C/VITRUVIO 8, MADRID, Spain, 28006","Spanish","Literature, Romance"
"REVISTA DE OCCIDENTE","0034-8635","0034-8635","FUNDACION JOSE ORTEGA Y GASSET","REVISTA DE OCCIDENTE FORTUNY 53, MADRID, SPAIN, 28010","Spanish","Humanities, Multidisciplinary"
"REVISTA ESPANOLA DE LINGUISTICA APLICADA","0213-2028","2254-6774","JOHN BENJAMINS PUBLISHING CO","PO BOX 36224, AMSTERDAM, NETHERLANDS, 1020 ME","Spanish","Language & Linguistics"
"REVISTA IBEROAMERICANA","0034-9631","2154-4794","LIVERPOOL UNIV PRESS","4 CAMBRIDGE ST, LIVERPOOL, ENGLAND, L69 7ZU","Spanish","Literature, Romance"
"REVISTA MUSICAL CHILENA","0716-2790","0717-6252","UNIV CHILE, FACULTY ARTS","CASILLA 2100, SANTIAGO, CHILE, 1264","Spanish","Music"
"REVISTA SIGNOS","0718-0934","0718-0934","EDICIONES UNIV VALPARAISO","CASILLA 1415, VALPARAISO, CHILE, 00000","Spanish","Language & Linguistics"
"REVOLUTIONARY RUSSIA","0954-6545","1743-7873","ROUTLEDGE JOURNALS, TAYLOR & FRANCIS LTD","2-4 PARK SQUARE, MILTON PARK, ABINGDON, ENGLAND, OXON, OX14 4RN","English","History"
"REVUE BELGE DE PHILOLOGIE ET D HISTOIRE","0035-0818","","REVUE BELGE PHILOLOGIE HISTOIRE","C/O BIBLIOTHEQUE ROYALE DE BELGIQUE, BOULEVARD DE L EMPEREUR 4, BRUSSELS, BELGIUM, B-1000","Multi-Language","History | Language & Linguistics | Literature"
"REVUE BIBLIQUE","0035-0907","2466-8583","PEETERS","BONDGENOTENLAAN 153, LEUVEN, BELGIUM, B-3000","Multi-Language","Religion"
"REVUE DE L ART","0035-1326","1953-812X","EDITIONS C N R S","20/22 RUE ST. AMAND, PARIS, FRANCE, 75015","French","Art"
"REVUE DE L HISTOIRE DES RELIGIONS","0035-1423","2105-2573","ARMAND COLIN","5 RUE LAROMIGUIERE, PARIS CEDEX 05, FRANCE, 75240","French","History | Religion"
"REVUE DE LINGUISTIQUE ROMANE","0035-1458","","SOC LINGUISTIQUE ROMANE","UNIV SCI HUMAINES 25 RUE DU MARECHAL-JUIN, STRASBOURG CEDEX, FRANCE, F-67084","Multi-Language","Language & Linguistics"
"REVUE DE METAPHYSIQUE ET DE MORALE","0035-1571","2102-5177","PRESSES UNIV FRANCE","6 AVENUE REILLE, PARIS CEDEX 14, FRANCE, 75685","French","Philosophy"
"REVUE DE MUSICOLOGIE","0035-1601","","EDITIONS TRANSATLANTIQUES","50 RUE JOSEPH DE MAISTRE, PARIS, FRANCE, 75018","French","Music"
"REVUE DES ETUDES JUIVES","0484-8616","1783-175X","PEETERS","BONDGENOTENLAAN 153, LEUVEN, BELGIUM, B-3000","Multi-Language","Humanities, Multidisciplinary"
"REVUE DES LANGUES ROMANES","0223-3711","2391-114X","REVUE DES LANGUES ROMANES","UNIV PAUL VALERY, BP 5043,, MONTPELLIER-CEDEX, FRANCE, 34052","French","Language & Linguistics | Literature, Romance"
"REVUE DES MUSEES DE FRANCE-REVUE DU LOUVRE","1962-4271","","CONSEIL MUSEES NATIONAUX","10 RUE DE L ABBAYE, PARIS, FRANCE, 75006","French","Art"
"REVUE DES SCIENCES PHILOSOPHIQUES ET THEOLOGIQUES","0035-2209","2118-4445","LIBRAIRIE PHILOS, J VRIN","6 PLACE SORBONNE, PARIS, FRANCE, 75005","French","Philosophy | Religion"
"REVUE DE SYNTHESE","0035-1776","1955-2343","BRILL","PLANTIJNSTRAAT 2, P O BOX 9000, LEIDEN, NETHERLANDS, 2300 PA","French","History | Literary Theory & Criticism | Philosophy"
"REVUE D HISTOIRE DES MATHEMATIQUES","1262-022X","1262-022X","SOC MATHEMATIQUE FRANCE","IPH 11 RUE PIERRE MARIE CURIE, PARIS, FRANCE, F 75231","Multi-Language","History & Philosophy Of Science"
"REVUE D HISTOIRE DU THEATRE","1291-2530","","SOC HISTOIRE THEATRE","BNF 58 RUE DE RICHELIEU, PARIS CEDEX 02, FRANCE, 75084","French","Theater"
"REVUE D HISTOIRE ECCLESIASTIQUE","0035-2381","2294-1088","CULTURA","HOENDERSTRAAT 22, WETTEREN, BELGIUM, B 9230","Multi-Language","History | Religion"
"REVUE D HISTOIRE LITTERAIRE DE LA FRANCE","0035-2411","2105-2689","CLASSIQUES GARNIER","6 RUE DE LA SORBONNE, PARIS, FRANCE, 75005","French","Literature, Romance"
"REVUE D HISTOIRE MODERNE ET CONTEMPORAINE","0048-8003","1776-3045","SOC HISTOIRE MODERNE CONTEMPORAINE","RHMC, BUREAU 114, 56 RUE JACOB, PARIS, FRANCE, F-75006","French","History"
"REVUE DU NORD","0035-2624","2271-7005","UNIV CHARLES DE GAULLE -LILLE III","REVUE DU NORD PONT DE BOIS B P 149, VILLENEUVE DASCQ, FRANCE, 59653","French","History"
"REVUE FRANCAISE DE LINGUISTIQUE APPLIQUEE","1386-1204","1875-368X","PUBLICATIONS LINGUISTIQUES","15 RUE LAKANAL, PARIS, FRANCE, 75015","French","Language & Linguistics"
"REVUE FRANCAISE D ETUDES AMERICAINES","0397-7870","1776-3061","ASSOC FRANCAISE ETUDES AMER","8 RUE FEROU, PARIS, FRANCE, 75278","Multi-Language","Humanities, Multidisciplinary"
"REVUE HISTORIQUE","0035-3264","2104-3825","PRESSES UNIV FRANCE","6 AVENUE REILLE, PARIS CEDEX 14, FRANCE, 75685","French","History"
"REVUE INTERNATIONALE DE PHILOSOPHIE","0048-8143","2033-0138","REVUE INT PHILOSOPHIE","UNIV LIBRE DE BRUXELLES, INST DE PHILOSOPHIE CP-188, AV. ROOSEVELT, 50, BRUSSELS, BELGIUM, B-1050","Multi-Language","Philosophy"
"REVUE PHILOSOPHIQUE DE LA FRANCE ET DE L ETRANGER","0035-3833","2104-385X","PRESSES UNIV FRANCE","6 AVENUE REILLE, PARIS CEDEX 14, FRANCE, 75685","French","Philosophy"
"REVUE PHILOSOPHIQUE DE LOUVAIN","0035-3841","1783-1768","PEETERS","BONDGENOTENLAAN 153, LEUVEN, BELGIUM, B-3000","French","Philosophy"
"REVUE ROMANE","0035-3906","1600-0811","JOHN BENJAMINS PUBLISHING CO","PO BOX 36224, AMSTERDAM, NETHERLANDS, 1020 ME","Multi-Language","Language & Linguistics | Literature, Romance"
"REVUE ROUMAINE DE LINGUISTIQUE-ROMANIAN REVIEW OF LINGUISTICS","0035-3957","0035-3957","EDITURA ACAD ROMANE","CALEA 13 SEPTEMBRIE NR 13, SECTOR 5, BUCURESTI, ROMANIA, 050711","Multi-Language","Language & Linguistics"
"REVUE ROUMAINE DE PHILOSOPHIE","1220-5400","","EDITURA ACAD ROMANE","CALEA 13 SEPTEMBRIE NR 13, SECTOR 5, BUCURESTI, ROMANIA, 050711","Multi-Language","Philosophy"
"REVUE THEOLOGIQUE DE LOUVAIN","0080-2654","1783-8401","PEETERS","BONDGENOTENLAAN 153, LEUVEN, BELGIUM, B-3000","French","Religion"
"RHETORICA-A JOURNAL OF THE HISTORY OF RHETORIC","0734-8584","1533-8541","JOHNS HOPKINS UNIV PRESS","JOURNALS PUBLISHING DIVISION, 2715 NORTH CHARLES ST, BALTIMORE, USA, MD, 21218-4363","Multi-Language","History | Literature"
"RHETORIC REVIEW","0735-0198","1532-7981","ROUTLEDGE JOURNALS, TAYLOR & FRANCIS LTD","2-4 PARK SQUARE, MILTON PARK, ABINGDON, ENGLAND, OXON, OX14 4RN","English","Language & Linguistics | Literature"
"RHETORIC SOCIETY QUARTERLY","0277-3945","1930-322X","ROUTLEDGE JOURNALS, TAYLOR & FRANCIS LTD","2-4 PARK SQUARE, MILTON PARK, ABINGDON, ENGLAND, OXON, OX14 4RN","English","Literature | Philosophy"
"RICERCHE DI STORIA DELL ARTE","0392-7202","0392-7202","NUOVA ITALIA SCIENTIFICA SPA","VIA SARDEGNA 50, ROME, ITALY, 00187","Italian","Art"
"RIDE-THE JOURNAL OF APPLIED THEATRE AND PERFORMANCE","1356-9783","1470-112X","ROUTLEDGE JOURNALS, TAYLOR & FRANCIS LTD","2-4 PARK SQUARE, MILTON PARK, ABINGDON, ENGLAND, OXON, OX14 4RN","English","Theater"
"RIHA JOURNAL","2190-3328","2190-3328","RIHA-INT ASSOC RESEARCH, INST HISTORY ART","C/O ZENTRALINSTITUT KUNSTGESCHICHTE, KATHARINA-VON-BORA-STRASSE 10, MUNCHEN, GERMANY, D-80333","English, French, German, Italian, Polish","Art"
"RIJKSMUSEUM BULLETIN","1877-8127","2772-6126","RIJKSMUSEUM AMSTERDAM-RIJKSMUSEM PUBLICATIONS","PO BOX 74888, AMSTERDAM, NETHERLANDS, 1070 DN","English","Art"
"RILCE-REVISTA DE FILOLOGIA HISPANICA","0213-2370","2174-0917","UNIV NAVARRA, SERVICIO PUBLICACIONES","CAMPUS UNIV, CARRETERA DEL SADAR S-N, APARTADO 177, PAMPLONA, SPAIN, 31080","Spanish","Language & Linguistics | Literature, Romance"
"RINASCIMENTO","0080-3073","2037-6138","CASA EDITRICE LEO S OLSCHKI","VIUZZO DEL POZZETTO, 8, FLORENCE, ITALY, I-50126","Multi-Language","Medieval & Renaissance Studies"
"RIVISTA DI ESTETICA","0035-6212","0035-6212","ROSENBERG & SELLIER","VIA ANDREA DORIA 14, TURIN, ITALY, 10123","English, French, Italian","Philosophy"
"RIVISTA DI FILOLOGIA E DI ISTRUZIONE CLASSICA","0035-6220","0035-6220","LOESCHER EDITORE","VIA VITTORIO AMEDEO II, 18, TORINO, ITALY, 10121","Multi-Language","Classics"
"RIVISTA DI FILOSOFIA NEO-SCOLASTICA","0035-6247","0035-6247","VITA PENSIERO","PUBBLICAZIONI DELL UNIV CATTOLICA DEL SACRO CUORE, LARGO A GEMELLI 1, MILAN, ITALY, 20123","Italian","Philosophy"
"RIVISTA DI LETTERATURE MODERNE E COMPARATE","0391-2108","","PACINI EDITORE","VIA DELLA GHERARDESCA-ZONA INDUSTRIALE OSPEDALETTO, PISA, ITALY, 56121","Multi-Language","Literature"
"RIVISTA DI STORIA DELLA FILOSOFIA","0393-2516","1972-5558","FRANCO ANGELI","VIALE MONZA 106, MILAN, Italy, 20127","Italian","Philosophy"
"RIVISTA DI STORIA E LETTERATURA RELIGIOSA","0035-6573","2035-7583","CASA EDITRICE LEO S OLSCHKI","VIUZZO DEL POZZETTO, 8, FLORENCE, ITALY, I-50126","Multi-Language","Religion"
"RIVISTA ITALIANA DI MUSICOLOGIA","0035-6867","2036-5586","ITALIAN SOC MUSICOLOGY","PO BOX 318, AG ROMA ACILIA SAPONARA, ROME, ITALY, 00125","English","Music"
"RIVISTA STORICA DELL ANTICHITA","0300-340X","","PATRON EDITORE S R L","VIA BADINI 12, QUARTO INFERIORE, BOLOGNA, ITALY, 00000","Multi-Language","Classics | History"
"RIVISTA STORICA ITALIANA","0035-7073","","EDIZIONI SCIENTIFICHE ITALIANE","VIA CHIATAMONE 7, NAPLES, ITALY, 80121","Italian","History"
"RLA-REVISTA DE LINGUISTICA TEORICA Y APLICADA","0718-4883","0718-4883","UNIV CONCEPCION, FAC HUMANIDADES ARTE","CASILLA 160-C, CORREO 3, CONCEPCION, CHILE, 00000","Spanish","Language & Linguistics"
"RLC-REVUE DE LITTERATURE COMPAREE","0035-1466","0035-1466","DIDIER-ERUDITION","6 RUE DE LA SORBONNE, PARIS, FRANCE, 75005","Multi-Language","Literature"
"ROCK ART RESEARCH","0813-0426","0813-0426","ARCHAEOLOGICAL PUBL","PO BOX 216, CAULFIELD SOUTH, AUSTRALIA, VIC 3162","English","Archaeology | Art"
"ROMANCE NOTES","0035-7995","2165-7599","UNIV NORTH CAROLINA","DEPT OF ROMANCE LANGUAGES, CHAPEL HILL, USA, NC, 27514","Multi-Language","Literature, Romance"
"ROMANCE PHILOLOGY","0035-8002","2295-9017","BREPOLS PUBL","BEGIJNHOF 67, TURNHOUT, BELGIUM, B-2300","Multi-Language","Language & Linguistics | Literature, Romance"
"ROMANCE QUARTERLY","0883-1157","1940-3216","ROUTLEDGE JOURNALS, TAYLOR & FRANCIS LTD","2-4 PARK SQUARE, MILTON PARK, ABINGDON, ENGLAND, OXON, OX14 4RN","Multi-Language","Literature, Romance"
"ROMANCE STUDIES","0263-9904","1745-8153","ROUTLEDGE JOURNALS, TAYLOR & FRANCIS LTD","2-4 PARK SQUARE, MILTON PARK, ABINGDON, ENGLAND, OXON, OX14 4RN","Multi-Language","Literature, Romance"
"ROMANISCHE FORSCHUNGEN","0035-8126","1864-0737","VITTORIO KLOSTERMANN GMBH","WESTERBACHSTRASSE 47, HAUS 1, FRANKFURT-AM-MAIN, GERMANY, D-60489","Multi-Language","Literature, Romance"
"ROMANISTISCHE ZEITSCHRIFT FUR LITERATURGESCHICHTE-CAHIERS D HISTOIRE DES LITTERATURES ROMANES","0343-379X","2509-7474","UNIVERSITATSVERLAG C WINTER HEIDELBERG GMBH","POSTFACH 10 61 40, HEIDELBERG, GERMANY, D-69051","Multi-Language","Literature, Romance"
"ROMANI STUDIES","1528-0748","1757-2274","LIVERPOOL UNIV PRESS","4 CAMBRIDGE ST, LIVERPOOL, ENGLAND, L69 7ZU","English","Humanities, Multidisciplinary"
"ROMANTICISM","1354-991X","1750-0192","EDINBURGH UNIV PRESS","THE TUN-HOLYROOD RD, 12 2F JACKSONS ENTRY, EDINBURGH, SCOTLAND, EH8 8PJ","English","Literature"
"ROMANTISME","0048-8593","1957-7958","EDITIONS SEDES","11, RUE SOUFFLOT, PARIS, FRANCE, F-75005","French","Literature"
"ROSSIISKAYA ARKHEOLOGIYA","0869-6063","0869-6063","IZDATELSTVO NAUKA","19 DMITRIYA ULYANOVA ST, MOSCOW, RUSSIA, 19117036","Russian","Archaeology"
"ROSSIISKAYA ISTORIYA","0869-5687","","ROSSIISKAYA AKAD NAUK, IZDATELSTVO NAUKA","PROFSOYUZNAYA UL 90, MOSCOW, RUSSIA, 117997","Russian","History"
"RURAL HISTORY-ECONOMY SOCIETY CULTURE","0956-7933","1474-0656","CAMBRIDGE UNIV PRESS","32 AVENUE OF THE AMERICAS, NEW YORK, USA, NY, 10013-2473","English","History"
"RUSSELL-THE JOURNAL OF THE BERTRAND RUSSELL STUDIES","0036-0163","1913-8032","BETRAND RUSSELL RESEARCH CENTRE","MCMASTER UNIVERSITY, HAMILTON, CANADA, ONTARIO, L8S 4M2","English","Philosophy"
"RUSSIAN HISTORY-HISTOIRE RUSSE","0094-288X","0094-288X","BRILL","PLANTIJNSTRAAT 2, P O BOX 9000, LEIDEN, NETHERLANDS, 2300 PA","Multi-Language","History"
"RUSSIAN LINGUISTICS","0304-3487","1572-8714","SPRINGER","VAN GODEWIJCKSTRAAT 30, DORDRECHT, NETHERLANDS, 3311 GZ","Multi-Language","Language & Linguistics"
"RUSSIAN LITERATURE","0304-3479","1878-3678","ELSEVIER","RADARWEG 29, AMSTERDAM, Netherlands, 1043 NX","Multi-Language","Literature, Slavic"
