"JOURNAL OF MODERN CRAFT","1749-6772","1749-6780","ROUTLEDGE JOURNALS, TAYLOR & FRANCIS LTD","2-4 PARK SQUARE, MILTON PARK, ABINGDON, ENGLAND, OXON, OX14 4RN","English","Art"
"JOURNAL OF MODERN EUROPEAN HISTORY","1611-8944","2631-9764","SAGE PUBLICATIONS LTD","1 OLIVERS YARD, 55 CITY ROAD, LONDON, ENGLAND, EC1Y 1SP","German","History"
"JOURNAL OF MODERN GREEK STUDIES","0738-1727","1086-3265","JOHNS HOPKINS UNIV PRESS","JOURNALS PUBLISHING DIVISION, 2715 NORTH CHARLES ST, BALTIMORE, USA, MD, 21218-4363","English","Humanities, Multidisciplinary"
"JOURNAL OF MODERN HISTORY","0022-2801","1537-5358","UNIV CHICAGO PRESS","1427 E 60TH ST, CHICAGO, USA, IL, 60637-2954","English","History"
"JOURNAL OF MODERN ITALIAN STUDIES","1354-571X","1469-9583","ROUTLEDGE JOURNALS, TAYLOR & FRANCIS LTD","2-4 PARK SQUARE, MILTON PARK, ABINGDON, ENGLAND, OXON, OX14 4RN","English","History"
"JOURNAL OF MODERN LITERATURE","0022-281X","1529-1464","INDIANA UNIV PRESS","601 N MORTON STREET, BLOOMINGTON, USA, IN, 47404-3797","English","Literature"
"JOURNAL OF MORAL PHILOSOPHY","1740-4681","1745-5243","BRILL","PLANTIJNSTRAAT 2, P O BOX 9000, LEIDEN, NETHERLANDS, 2300 PA","English","Philosophy"
"JOURNAL OF MULTILINGUAL AND MULTICULTURAL DEVELOPMENT","0143-4632","1747-7557","ROUTLEDGE JOURNALS, TAYLOR & FRANCIS LTD","2-4 PARK SQUARE, MILTON PARK, ABINGDON, ENGLAND, OXON, OX14 4RN","English","Language & Linguistics"
"JOURNAL OF MUSICOLOGICAL RESEARCH","0141-1896","1547-7304","TAYLOR & FRANCIS LTD","2-4 PARK SQUARE, MILTON PARK, ABINGDON, England, OXON, OX14 4RN","English","Music"
"JOURNAL OF MUSICOLOGY","0277-9269","1533-8347","UNIV CALIFORNIA PRESS","155 GRAND AVE, SUITE 400, OAKLAND, USA, CA, 94612-3758","English","Music"
"JOURNAL OF MUSIC THEORY","0022-2909","1941-7497","DUKE UNIV PRESS","905 W MAIN ST, STE 18-B, DURHAM, USA, NC, 27701","English","Music"
"JOURNAL OF NEAR EASTERN STUDIES","0022-2968","1545-6978","UNIV CHICAGO PRESS","1427 E 60TH ST, CHICAGO, USA, IL, 60637-2954","English","Archaeology | Asian Studies"
"JOURNAL OF NEW MUSIC RESEARCH","0929-8215","1744-5027","ROUTLEDGE JOURNALS, TAYLOR & FRANCIS LTD","2-4 PARK SQUARE, MILTON PARK, ABINGDON, ENGLAND, OXON, OX14 4RN","English","Music"
"JOURNAL OF NIETZSCHE STUDIES","0968-8005","1538-4594","PENN STATE UNIV PRESS","820 NORTH UNIV DRIVE, U S B 1, STE C, UNIVERSITY PK, USA, PA, 16802","English","Philosophy"
"JOURNAL OF PACIFIC HISTORY","0022-3344","1469-9605","ROUTLEDGE JOURNALS, TAYLOR & FRANCIS LTD","2-4 PARK SQUARE, MILTON PARK, ABINGDON, ENGLAND, OXON, OX14 4RN","English","History"
"JOURNAL OF PHILOSOPHICAL LOGIC","0022-3611","1573-0433","SPRINGER","VAN GODEWIJCKSTRAAT 30, DORDRECHT, NETHERLANDS, 3311 GZ","English","Philosophy"
"JOURNAL OF PHILOSOPHICAL RESEARCH","1053-8364","2153-7984","PHILOSOPHY DOCUMENTATION CENTER","PO BOX 7147, CHARLOTTESVILLE, USA, VA, 22906-7147","English","Philosophy"
"JOURNAL OF PHILOSOPHY","0022-362X","1939-8549","J PHILOSOPHY INC","COLUMBIA UNIV 709 PHILOSOPHY HALL, NEW YORK, USA, NY, 10027","English","Philosophy"
"JOURNAL OF PHONETICS","0095-4470","1095-8576","ACADEMIC PRESS LTD- ELSEVIER SCIENCE LTD","24-28 OVAL RD, LONDON, ENGLAND, NW1 7DX","English","Language & Linguistics"
"JOURNAL OF PIDGIN AND CREOLE LANGUAGES","0920-9034","1569-9870","JOHN BENJAMINS PUBLISHING CO","PO BOX 36224, AMSTERDAM, NETHERLANDS, 1020 ME","English","Language & Linguistics"
"JOURNAL OF POLICY HISTORY","0898-0306","1528-4190","CAMBRIDGE UNIV PRESS","32 AVENUE OF THE AMERICAS, NEW YORK, USA, NY, 10013-2473","English","History"
"JOURNAL OF POLITENESS RESEARCH-LANGUAGE BEHAVIOUR CULTURE","1612-5681","1613-4877","DE GRUYTER MOUTON","GENTHINER STRASSE 13, BERLIN, GERMANY, 10785","English","Language & Linguistics"
"JOURNAL OF POPULAR CULTURE","0022-3840","1540-5931","WILEY","111 RIVER ST, HOBOKEN, USA, NJ, 07030-5774","English","Humanities, Multidisciplinary | Cultural Studies"
"JOURNAL OF POPULAR FILM AND TELEVISION","0195-6051","1930-6458","ROUTLEDGE JOURNALS, TAYLOR & FRANCIS LTD","2-4 PARK SQUARE, MILTON PARK, ABINGDON, ENGLAND, OXON, OX14 4RN","English","Film, Radio, Television"
"JOURNAL OF POPULAR MUSIC STUDIES","1524-2226","1533-1598","UNIV CALIFORNIA PRESS","155 GRAND AVE, SUITE 400, OAKLAND, USA, CA, 94612-3758","English","Music"
"JOURNAL OF POSTCOLONIAL WRITING","1744-9855","1744-9863","ROUTLEDGE JOURNALS, TAYLOR & FRANCIS LTD","2-4 PARK SQUARE, MILTON PARK, ABINGDON, ENGLAND, OXON, OX14 4RN","English","Literature"
"JOURNAL OF PRAGMATICS","0378-2166","1879-1387","ELSEVIER","RADARWEG 29, AMSTERDAM, Netherlands, 1043 NX","Multi-Language","Language & Linguistics"
"JOURNAL OF PRE-RAPHAELITE STUDIES-NEW SERIES","1060-149X","1060-149X","JOURNAL PRE-RAPHAELITE STUDIES","C/O DAVID LATHAM, EDITOR, YORK UNIV, 208 STONG COLLEGE, TORONTO, CANADA, ONTARIO, M3J 1P3","English","Humanities, Multidisciplinary"
"JOURNAL OF PRESBYTERIAN HISTORY","1521-9216","1521-9216","PRESBYTERIAN HISTORICAL SOC","425 LOMBARD ST, PHILADELPHIA, USA, PA, 19147","English","Religion"
"JOURNAL OF PSYCHOLOGY AND THEOLOGY","0091-6471","2328-1162","SAGE PUBLICATIONS INC","2455 TELLER RD, THOUSAND OAKS, USA, CA, 91320","English","Religion"
"JOURNAL OF QUANTITATIVE LINGUISTICS","0929-6174","1744-5035","ROUTLEDGE JOURNALS, TAYLOR & FRANCIS LTD","2-4 PARK SQUARE, MILTON PARK, ABINGDON, ENGLAND, OXON, OX14 4RN","English","Language & Linguistics"
"JOURNAL OF QURANIC STUDIES","1465-3591","1755-1730","EDINBURGH UNIV PRESS","THE TUN-HOLYROOD RD, 12 2F JACKSONS ENTRY, EDINBURGH, SCOTLAND, EH8 8PJ","English","Religion"
"JOURNAL OF RELIGION","0022-4189","1549-6538","UNIV CHICAGO PRESS","1427 E 60TH ST, CHICAGO, USA, IL, 60637-2954","English","Religion"
"JOURNAL OF RELIGION & HEALTH","0022-4197","1573-6571","SPRINGER","ONE NEW YORK PLAZA, SUITE 4600 , NEW YORK, United States, NY, 10004","English","Religion"
"JOURNAL OF RELIGION IN AFRICA","0022-4200","1570-0666","BRILL","PLANTIJNSTRAAT 2, P O BOX 9000, LEIDEN, NETHERLANDS, 2300 PA","English","Religion"
"JOURNAL OF RELIGIOUS ETHICS","0384-9694","1467-9795","WILEY","111 RIVER ST, HOBOKEN, USA, NJ, 07030-5774","English","Religion"
"JOURNAL OF RELIGIOUS HISTORY","0022-4227","1467-9809","WILEY","111 RIVER ST, HOBOKEN, USA, NJ, 07030-5774","English","History | Religion"
"JOURNAL OF RESEARCH IN MUSIC EDUCATION","0022-4294","1945-0095","SAGE PUBLICATIONS INC","2455 TELLER RD, THOUSAND OAKS, USA, CA, 91320","English","Music"
"JOURNAL OF ROMAN ARCHAEOLOGY","1047-7594","2331-5709","CAMBRIDGE UNIV PRESS","32 AVENUE OF THE AMERICAS, NEW YORK, USA, NY, 10013-2473","Multi-Language","Archaeology"
"JOURNAL OF ROMAN STUDIES","0075-4358","1753-528X","CAMBRIDGE UNIV PRESS","EDINBURGH BLDG, SHAFTESBURY RD, CAMBRIDGE, ENGLAND, CB2 8RU","Multi-Language","Classics"
"JOURNAL OF SCHOLARLY PUBLISHING","1198-9742","1710-1166","UNIV TORONTO PRESS INC","JOURNALS DIVISION, 5201 DUFFERIN ST, DOWNSVIEW, TORONTO, CANADA, ON, M3H 5T8","English","Humanities, Multidisciplinary"
"JOURNAL OF SCREENWRITING","1759-7137","1759-7145","INTELLECT LTD","THE MILL, PARNALL RD, BRISTOL, ENGLAND, BS16 3JG","English","Film, Radio, Television | Literature"
"JOURNAL OF SEMANTICS","0167-5133","1477-4593","OXFORD UNIV PRESS","GREAT CLARENDON ST, OXFORD, ENGLAND, OX2 6DP","English","Language & Linguistics"
"JOURNAL OF SEMITIC STUDIES","0022-4480","1477-8556","OXFORD UNIV PRESS","GREAT CLARENDON ST, OXFORD, ENGLAND, OX2 6DP","English","Asian Studies"
"JOURNAL OF SHIA ISLAMIC STUDIES","1748-9423","2051-557X","ISLAMIC COLL ADVANCED STUDIES-ICAS","133 HIGH RD, LONDON, ENGLAND, WILLESDEN, NW10 2SW","","Religion"
"JOURNAL OF SOCIAL ARCHAEOLOGY","1469-6053","1741-2951","SAGE PUBLICATIONS LTD","1 OLIVERS YARD, 55 CITY ROAD, LONDON, ENGLAND, EC1Y 1SP","English","Archaeology"
"JOURNAL OF SOCIAL HISTORY","0022-4529","1527-1897","OXFORD UNIV PRESS INC","JOURNALS DEPT, 2001 EVANS RD, CARY, USA, NC, 27513","English","History"
"JOURNAL OF SOCIAL PHILOSOPHY","0047-2786","1467-9833","WILEY","111 RIVER ST, HOBOKEN, USA, NJ, 07030-5774","English","Philosophy"
"JOURNAL OF SONG-YUAN STUDIES","1059-3152","2154-6665","JOHNS HOPKINS UNIV PRESS","JOURNALS PUBLISHING DIVISION, 2715 NORTH CHARLES ST, BALTIMORE, USA, MD, 21218-4363","English","History | Asian Studies"
"JOURNAL OF SOUTHEAST ASIAN STUDIES","0022-4634","1474-0680","CAMBRIDGE UNIV PRESS","32 AVENUE OF THE AMERICAS, NEW YORK, USA, NY, 10013-2473","English","Asian Studies"
"JOURNAL OF SOUTHERN HISTORY","0022-4642","2325-6893","SOUTHERN HISTORICAL ASSOC","UNIV GEORGIA, HISTORY DEPT, ATHENS, USA, GA, 30602","English","History"
"JOURNAL OF SPANISH CULTURAL STUDIES","1463-6204","1469-9818","ROUTLEDGE JOURNALS, TAYLOR & FRANCIS LTD","2-4 PARK SQUARE, MILTON PARK, ABINGDON, ENGLAND, OXON, OX14 4RN","Multi-Language","Cultural Studies"
"JOURNAL OF SPECIALISED TRANSLATION","1740-357X","1740-357X","ROEHAMPTON UNIV SCH ARTS","DIGBY STUART COLL, ROEHAMPTON LA, LONDON, ENGLAND, SW15 5PH","English, French, German, Italian, Spanish","Language & Linguistics"
"JOURNAL OF SPECULATIVE PHILOSOPHY","0891-625X","1527-9383","PENN STATE UNIV PRESS","820 NORTH UNIV DRIVE, U S B 1, STE C, UNIVERSITY PK, USA, PA, 16802","English","Philosophy"
"JOURNAL OF THE AMERICAN ACADEMY OF RELIGION","0002-7189","1477-4585","OXFORD UNIV PRESS INC","JOURNALS DEPT, 2001 EVANS RD, CARY, USA, NC, 27513","English","Religion"
"JOURNAL OF THE AMERICAN INSTITUTE FOR CONSERVATION","0197-1360","1945-2330","ROUTLEDGE JOURNALS, TAYLOR & FRANCIS LTD","2-4 PARK SQUARE, MILTON PARK, ABINGDON, ENGLAND, OXON, OX14 4RN","English","Humanities, Multidisciplinary"
"JOURNAL OF THE AMERICAN MUSICOLOGICAL SOCIETY","0003-0139","1547-3848","UNIV CALIFORNIA PRESS","155 GRAND AVE, SUITE 400, OAKLAND, USA, CA, 94612-3758","English","Music"
"JOURNAL OF THE AMERICAN ORIENTAL SOCIETY","0003-0279","2169-2289","AMER ORIENTAL SOC","HARLAN HATCHER GRADUATE LIB UNIV MICHIGAN, ANN ARBOR, USA, MI, 48109-1205","English","Asian Studies"
"JOURNAL OF THE AMERICAN PHILOSOPHICAL ASSOCIATION","2053-4477","2053-4485","CAMBRIDGE UNIV PRESS","32 AVENUE OF THE AMERICAS, NEW YORK, USA, NY, 10013-2473","English","Philosophy"
"JOURNAL OF THE BRITISH ARCHAEOLOGICAL ASSOCIATION","0068-1288","1747-6704","ROUTLEDGE JOURNALS, TAYLOR & FRANCIS LTD","2-4 PARK SQUARE, MILTON PARK, ABINGDON, ENGLAND, OXON, OX14 4RN","English","Archaeology | Medieval & Renaissance Studies"
"JOURNAL OF THE BRITISH SOCIETY FOR PHENOMENOLOGY","0007-1773","2332-0486","JACKSON PUBLISHING & DISTRIBUTION","3 GIBSONS RD, HEATON MOOR, STOCKPORT, CHESHIRE, ENGLAND, SK4 4JX","English","Philosophy"
"JOURNAL OF THE EARLY REPUBLIC","0275-1275","1553-0620","UNIV PENNSYLVANIA PRESS","JOURNALS DIVISION, 3905 SPRUCE STREET, PHILADELPHIA, USA, PA, 19104","English","History"
"JOURNAL OF THE ECONOMIC AND SOCIAL HISTORY OF THE ORIENT","0022-4995","1568-5209","BRILL","PLANTIJNSTRAAT 2, P O BOX 9000, LEIDEN, NETHERLANDS, 2300 PA","English","History"
"JOURNAL OF THE GILDED AGE AND PROGRESSIVE ERA","1537-7814","1943-3557","CAMBRIDGE UNIV PRESS","32 AVENUE OF THE AMERICAS, NEW YORK, USA, NY, 10013-2473","English","History"
"JOURNAL OF THE HISTORY OF BIOLOGY","0022-5010","1573-0387","SPRINGER","VAN GODEWIJCKSTRAAT 30, DORDRECHT, NETHERLANDS, 3311 GZ","English","History & Philosophy Of Science"
"JOURNAL OF THE HISTORY OF COLLECTIONS","0954-6650","1477-8564","OXFORD UNIV PRESS","GREAT CLARENDON ST, OXFORD, ENGLAND, OX2 6DP","English","Humanities, Multidisciplinary"
"JOURNAL OF THE HISTORY OF ECONOMIC THOUGHT","1053-8372","1469-9656","CAMBRIDGE UNIV PRESS","32 AVENUE OF THE AMERICAS, NEW YORK, USA, NY, 10013-2473","English","History"
"JOURNAL OF THE HISTORY OF IDEAS","0022-5037","1086-3222","UNIV PENNSYLVANIA PRESS","JOURNALS DIVISION, 3905 SPRUCE STREET, PHILADELPHIA, USA, PA, 19104","English","Philosophy"
"JOURNAL OF THE HISTORY OF MEDICINE AND ALLIED SCIENCES","0022-5045","1468-4373","OXFORD UNIV PRESS INC","JOURNALS DEPT, 2001 EVANS RD, CARY, USA, NC, 27513","English","History & Philosophy Of Science"
"JOURNAL OF THE HISTORY OF PHILOSOPHY","0022-5053","1538-4586","JOHNS HOPKINS UNIV PRESS","JOURNALS PUBLISHING DIVISION, 2715 NORTH CHARLES ST, BALTIMORE, USA, MD, 21218-4363","Multi-Language","Philosophy"
"JOURNAL OF THE HISTORY OF SEXUALITY","1043-4070","1535-3605","UNIV TEXAS PRESS","JOURNAL DIV, 2100 COMAL, AUSTIN, USA, TX, 78722","English","History"
"JOURNAL OF THE INTERNATIONAL PHONETIC ASSOCIATION","0025-1003","1475-3502","CAMBRIDGE UNIV PRESS","EDINBURGH BLDG, SHAFTESBURY RD, CAMBRIDGE, ENGLAND, CB2 8RU","English","Language & Linguistics"
"JOURNAL OF THE MIDWEST MODERN LANGUAGE ASSOCIATION","0742-5562","2162-6294","MIDWEST MODERN LANGUAGE ASSOC","LOYOLA UNIV CHICAGO, DEPT ENGLISH, 1032 W SHERIDAN RD, CHICAGO, USA, IL, 60660","English","Literature"
"JOURNAL OF THE MUSICAL ARTS IN AFRICA","1812-1004","2070-626X","ROUTLEDGE JOURNALS, TAYLOR & FRANCIS LTD","2-4 PARK SQUARE, MILTON PARK, ABINGDON, ENGLAND, OXON, OX14 4RN","English","Music"
"JOURNAL OF THEOLOGICAL STUDIES","0022-5185","1477-4607","OXFORD UNIV PRESS","GREAT CLARENDON ST, OXFORD, ENGLAND, OX2 6DP","English","Religion"
"JOURNAL OF THE PHILOSOPHY OF HISTORY","1872-261X","1872-2636","BRILL","PLANTIJNSTRAAT 2, P O BOX 9000, LEIDEN, NETHERLANDS, 2300 PA","English","History | Philosophy"
"JOURNAL OF THE ROYAL ASIATIC SOCIETY","1356-1863","1474-0591","CAMBRIDGE UNIV PRESS","32 AVENUE OF THE AMERICAS, NEW YORK, USA, NY, 10013-2473","English","Asian Studies"
"JOURNAL OF THE ROYAL MUSICAL ASSOCIATION","0269-0403","1471-6933","CAMBRIDGE UNIV PRESS","EDINBURGH BLDG, SHAFTESBURY RD, CAMBRIDGE, ENGLAND, CB2 8RU","English","Music"
"JOURNAL OF THE SOCIETY FOR AMERICAN MUSIC","1752-1963","1752-1971","CAMBRIDGE UNIV PRESS","32 AVENUE OF THE AMERICAS, NEW YORK, USA, NY, 10013-2473","English","Music"
"JOURNAL OF THE SOCIETY OF ARCHITECTURAL HISTORIANS","0037-9808","2150-5926","SOC ARCHITECTURAL HISTORIANS","1365 NORTH ASTOR ST, CHICAGO, USA, IL, 60610-2144","English","Architecture"
"JOURNAL OF THE SOCIETY OF CHRISTIAN ETHICS","1540-7942","2326-2176","SOC CHRISTIAN ETHICS","ST JOHN'S UNIV, SCHOOL THEOLOGY-SEMINARY, PO BOX 50370, COLLEGEVILLE, USA, MN, 56321-5633","English","Religion"
"JOURNAL OF THE SOUTHWEST","0894-8410","2158-1371","UNIV ARIZONA","LIBRARY C327, TUCSON, USA, AZ, 85721","English","History"
"JOURNAL OF THE WARBURG AND COURTAULD INSTITUTES","0075-4390","2044-0014","WARBURG INST","UNIV LONDON WOBURN SQUARE, LONDON, ENGLAND, WC1H 0AB","Multi-Language","Art"
"JOURNAL OF THE WEST","0022-5169","1930-0115","ABC-CLIO","130 CREMONA DR, SANTA BARBARA, USA, CA, 93117","English","History"
"JOURNAL OF URBAN HISTORY","0096-1442","1552-6771","SAGE PUBLICATIONS INC","2455 TELLER RD, THOUSAND OAKS, USA, CA, 91320","English","History"
"JOURNAL OF VALUE INQUIRY","0022-5363","1573-0492","SPRINGER","VAN GODEWIJCKSTRAAT 30, DORDRECHT, NETHERLANDS, 3311 GZ","English","Philosophy"
"JOURNAL OF VICTORIAN CULTURE","1355-5502","1750-0133","OXFORD UNIV PRESS","GREAT CLARENDON ST, OXFORD, ENGLAND, OX2 6DP","English","History"
"JOURNAL OF VISUAL CULTURE","1470-4129","1741-2994","SAGE PUBLICATIONS INC","2455 TELLER RD, THOUSAND OAKS, USA, CA, 91320","English","Art | Cultural Studies"
"JOURNAL OF WOMENS HISTORY","1042-7961","1527-2036","JOHNS HOPKINS UNIV PRESS","JOURNALS PUBLISHING DIVISION, 2715 NORTH CHARLES ST, BALTIMORE, USA, MD, 21218-4363","English","History"
"JOURNAL OF WORLD HISTORY","1045-6007","1527-8050","UNIV HAWAII PRESS","2840 KOLOWALU ST, HONOLULU, United States, HI, 96822","English","History"
"JOURNAL OF WORLD PREHISTORY","0892-7537","1573-7802","SPRINGER","ONE NEW YORK PLAZA, SUITE 4600 , NEW YORK, United States, NY, 10004","English","Archaeology"
"JUDAICA BOHEMIAE","0022-5738","0022-5738","ZIDOVSKE MUZEUM PRAZE","U STARE SKOLY 1, 3, PRAHA 1, CZECH REPUBLIC, 110 01","English","Religion"
"JUNCTURES-THE JOURNAL FOR THEMATIC DIALOGUE","1176-5119","1179-8912","OTAGO POLYTECHNIC-TE KURA MATATINI KI OTAGO","PRIVATE BAG 1910, DUNEDIN, NEW ZEALAND, 00000","English","Humanities, Multidisciplinary"
"JUNG JOURNAL-CULTURE & PSYCHE","1934-2039","1934-2047","ROUTLEDGE JOURNALS, TAYLOR & FRANCIS LTD","2-4 PARK SQUARE, MILTON PARK, ABINGDON, ENGLAND, OXON, OX14 4RN","English","Humanities, Multidisciplinary"
"KANTIAN REVIEW","1369-4154","2044-2394","CAMBRIDGE UNIV PRESS","EDINBURGH BLDG, SHAFTESBURY RD, CAMBRIDGE, ENGLAND, CB2 8RU","English","Philosophy"
"KANT-STUDIEN","0022-8877","1613-1134","WALTER DE GRUYTER GMBH","GENTHINER STRASSE 13, BERLIN, GERMANY, D-10785","Multi-Language","Philosophy"
"KEATS-SHELLEY JOURNAL","0453-4387","","KEATS-SHELLEY ASSOC AMER INC","NEW YORK PUBLIC LIBRARY, RM 226, FIFTH AVE, 42ND ST, NEW YORK, USA, NY, 10018-2788","English","Poetry"
"KEATS-SHELLEY REVIEW","0952-4142","2042-1362","ROUTLEDGE JOURNALS, TAYLOR & FRANCIS LTD","2-4 PARK SQUARE, MILTON PARK, ABINGDON, ENGLAND, OXON, OX14 4RN","English","Poetry"
"KENNEDY INSTITUTE OF ETHICS JOURNAL","1054-6863","1086-3249","JOHNS HOPKINS UNIV PRESS","JOURNALS PUBLISHING DIVISION, 2715 NORTH CHARLES ST, BALTIMORE, USA, MD, 21218-4363","English","Philosophy"
"KENYON REVIEW","0163-075X","2327-8307","KENYON COLLEGE","FINN HOUSE, 102 W WIGGIN ST, GAMBIER, USA, OH, 43022-9623","English","Literary Reviews"
"KNJIZEVNA SMOTRA","0455-0463","2459-6329","FILOZOFSKI FAKULTET","IVANA LUCICA 3, ZAGREB, CROATIA, 10 000","Croatian","Literature, Slavic"
"KONSTHISTORISK TIDSKRIFT","0023-3609","1651-2294","ROUTLEDGE JOURNALS, TAYLOR & FRANCIS LTD","2-4 PARK SQUARE, MILTON PARK, ABINGDON, ENGLAND, OXON, OX14 4RN","Multi-Language","Art"
"KOREA JOURNAL","0023-3900","0023-3900","ACAD KOREAN STUDIES","323 HAOGAE-RO BUNDANG-GU SEONGNAM-SI, GYEONGGI-DO, SOUTH KOREA, 13455","English","Asian Studies"
"KOREAN JOURNAL OF MEDICAL HISTORY","1225-505X","2093-5609","KOREAN SOC HIST MED","YONSEI UNIV COLL MED, DEPT MED HIST, 50-1 YONSEI-RO, SEODAEMUN-GU, SEOUL, SOUTH KOREA, 03722","Korean, English","History & Philosophy Of Science | Asian Studies"
"KRITERION-REVISTA DE FILOSOFIA","0100-512X","1981-5336","UNIV FED MINAS GERAIS, DEPT FILOSOFIA & CIENCIAS HUMANAS","AV ANTONIO CARLOS, 6627 CAMPUS PAMPULHA, BELO HORIZONTE MG, BRAZIL, CEP31270-301","English, French, German, Italian, Portuguese, Spanish","Philosophy"
"KRITIKA-EXPLORATIONS IN RUSSIAN AND EURASIAN HISTORY","1531-023X","1538-5000","SLAVICA PUBLISHERS","INDIANA UNIV, 2611 E 10TH ST, BLOOMINGTON, USA, IN, 47408-2603","English","History"
"KRITIKA KULTURA","2094-6937","","ATENEO DE MANILA UNIV","SCH HUMANITIES, DEPT ENGLISH, LOYOLA HEIGHTS, QUEZON CITY, PHILIPPINES, 1108","Multi-Language","Language & Linguistics | Literature"
"KUNSTITEADUSLIKKE UURIMUSI","1406-2860","","ESTONIAN SOCIETY ART HISTORIANS","VABADUSE VALJAK 6, TALLINN, ESTONIA, 10146","Multi-Language","Art"
"KWARTALNIK HISTORII ZYDOW-JEWISH HISTORY QUARTERLY","1899-3044","1899-3044","JEWISH HISTORICAL INST","UL TLOMACKIE 3-5, WARSAW, POLAND, 00-090","Polish","History"
"LABORATORY PHONOLOGY","1868-6346","1868-6354","UBIQUITY PRESS LTD","Unit 3.22, East London Works, 65-75 Whitechapel Road, LONDON, England, E1 1DU","English","Language & Linguistics"
"LABOR HISTORY","0023-656X","1469-9702","ROUTLEDGE JOURNALS, TAYLOR & FRANCIS LTD","2-4 PARK SQUARE, MILTON PARK, ABINGDON, ENGLAND, OXON, OX14 4RN","English","History"
"LABOUR HISTORY REVIEW","0961-5652","1745-8188","LIVERPOOL UNIV PRESS","4 CAMBRIDGE ST, LIVERPOOL, ENGLAND, L69 7ZU","English","History"
"LABOUR-LE TRAVAIL","0700-3862","1911-4842","CANADIAN COMMITTEE LABOUR HISTORY","MEMORIAL UNIV NEWFOUNDLAND DEPT HISTORY, ST JOHNS, CANADA, NEWFOUNDLAND, A1C 5S7","Multi-Language","History"
"LANDFALL","0023-7930","","UNIV OTAGO PRESS","PO BOX 56, DUNEDIN, NEW ZEALAND,","English","Literary Reviews"
"LANDSCAPE ARCHITECTURE MAGAZINE","0023-8031","0023-8031","AMER SOC LANDSCAPE ARCHITECTS","636 EYE ST, NW, WASHINGTON, USA, DC, 20001-3736","English","Architecture"
"LANGAGES","0458-726X","1958-9549","ARMAND COLIN","5 RUE LAROMIGUIERE, PARIS CEDEX 05, FRANCE, 75240","French","Language & Linguistics"
"LANGUAGE","0097-8507","1535-0665","LINGUISTIC SOC AMER","1325 18TH ST NW, SUITE 211, WASHINGTON, USA, DC, 20036-6501","English","Language & Linguistics"
"LANGUAGE ACQUISITION","1048-9223","1532-7817","ROUTLEDGE JOURNALS, TAYLOR & FRANCIS LTD","2-4 PARK SQUARE, MILTON PARK, ABINGDON, ENGLAND, OXON, OX14 4RN","English","Language & Linguistics"
"LANGUAGE AND COGNITION","1866-9808","1866-9859","CAMBRIDGE UNIV PRESS","EDINBURGH BLDG, SHAFTESBURY RD, CAMBRIDGE, ENGLAND, CB2 8RU","English","Language & Linguistics"
"LANGUAGE AND EDUCATION","0950-0782","1747-7581","ROUTLEDGE JOURNALS, TAYLOR & FRANCIS LTD","2-4 PARK SQUARE, MILTON PARK, ABINGDON, ENGLAND, OXON, OX14 4RN","English","Language & Linguistics"
"LANGUAGE AND INTERCULTURAL COMMUNICATION","1470-8477","1747-759X","ROUTLEDGE JOURNALS, TAYLOR & FRANCIS LTD","2-4 PARK SQUARE, MILTON PARK, ABINGDON, ENGLAND, OXON, OX14 4RN","English","Language & Linguistics"
"LANGUAGE AND LINGUISTICS","1606-822X","2309-5067","ACAD SINICA, INST LINGUISTICS","NO 130, SEC 2, ACADEMIA RD, TAIPEI, Taiwan, 11529","Multi-Language","Language & Linguistics"
"LANGUAGE AND LITERATURE","0963-9470","1461-7293","SAGE PUBLICATIONS LTD","1 OLIVERS YARD, 55 CITY ROAD, LONDON, ENGLAND, EC1Y 1SP","English","Language & Linguistics"
"LANGUAGE ASSESSMENT QUARTERLY","1543-4303","1543-4311","ROUTLEDGE JOURNALS, TAYLOR & FRANCIS LTD","2-4 PARK SQUARE, MILTON PARK, ABINGDON, ENGLAND, OXON, OX14 4RN","English","Language & Linguistics"
"LANGUAGE AWARENESS","0965-8416","1747-7565","ROUTLEDGE JOURNALS, TAYLOR & FRANCIS LTD","2-4 PARK SQUARE, MILTON PARK, ABINGDON, ENGLAND, OXON, OX14 4RN","English","Language & Linguistics"
"LANGUAGE CULTURE AND CURRICULUM","0790-8318","1747-7573","ROUTLEDGE JOURNALS, TAYLOR & FRANCIS LTD","2-4 PARK SQUARE, MILTON PARK, ABINGDON, ENGLAND, OXON, OX14 4RN","English","Language & Linguistics"
"LANGUAGE & HISTORY","1759-7536","1759-7544","ROUTLEDGE JOURNALS, TAYLOR & FRANCIS LTD","2-4 PARK SQUARE, MILTON PARK, ABINGDON, ENGLAND, OXON, OX14 4RN","Multi-Language","History | Language & Linguistics"
"LANGUAGE LEARNING AND DEVELOPMENT","1547-5441","1547-3341","ROUTLEDGE JOURNALS, TAYLOR & FRANCIS LTD","2-4 PARK SQUARE, MILTON PARK, ABINGDON, ENGLAND, OXON, OX14 4RN","English","Language & Linguistics"
"LANGUAGE MATTERS","1022-8195","1753-5395","ROUTLEDGE JOURNALS, TAYLOR & FRANCIS LTD","2-4 PARK SQUARE, MILTON PARK, ABINGDON, ENGLAND, OXON, OX14 4RN","English","Language & Linguistics"
"LANGUAGE POLICY","1568-4555","1573-1863","SPRINGER","VAN GODEWIJCKSTRAAT 30, DORDRECHT, NETHERLANDS, 3311 GZ","English","Language & Linguistics"
"LANGUAGE PROBLEMS & LANGUAGE PLANNING","0272-2690","1569-9889","JOHN BENJAMINS PUBLISHING CO","PO BOX 36224, AMSTERDAM, NETHERLANDS, 1020 ME","English","Language & Linguistics"
"LANGUAGE SCIENCES","0388-0001","1873-5746","ELSEVIER SCI LTD","THE BOULEVARD, LANGFORD LANE, KIDLINGTON, OXFORD, ENGLAND, OXON, OX5 1GB","English","Language & Linguistics"
"LANGUAGE TEACHING","0261-4448","1475-3049","CAMBRIDGE UNIV PRESS","EDINBURGH BLDG, SHAFTESBURY RD, CAMBRIDGE, ENGLAND, CB2 8RU","English","Language & Linguistics"
"LANGUAGE TESTING","0265-5322","1477-0946","SAGE PUBLICATIONS LTD","1 OLIVERS YARD, 55 CITY ROAD, LONDON, ENGLAND, EC1Y 1SP","English","Language & Linguistics"
"LANGUAGE VARIATION AND CHANGE","0954-3945","1469-8021","CAMBRIDGE UNIV PRESS","EDINBURGH BLDG, SHAFTESBURY RD, CAMBRIDGE, ENGLAND, CB2 8RU","English","Language & Linguistics"
"LANGUE FRANCAISE","0023-8368","1957-7982","LAROUSSE","17 RUE DE MONTPARNASSE, PARIS, FRANCE, 75006","French","Language & Linguistics"
"LATE IMPERIAL CHINA","0884-3236","1086-3257","JOHNS HOPKINS UNIV PRESS","JOURNALS PUBLISHING DIVISION, 2715 NORTH CHARLES ST, BALTIMORE, USA, MD, 21218-4363","English","History"
"LATIN AMERICAN ANTIQUITY","1045-6635","2325-5080","CAMBRIDGE UNIV PRESS","32 AVENUE OF THE AMERICAS, NEW YORK, USA, NY, 10013-2473","Multi-Language","Archaeology"
"LATIN AMERICAN MUSIC REVIEW-REVISTA DE MUSICA LATINOAMERICANA","0163-0350","1536-0199","UNIV TEXAS PRESS","JOURNAL DIV, 2100 COMAL, AUSTIN, USA, TX, 78722","Multi-Language","Music"
"LATIN AMERICAN THEATRE REVIEW","0023-8813","2161-0576","UNIV KANSAS","LIB, CENTER OF LATIN AMER STUDIES, 1425 JAYHAWK BLVD, LAWRENCE, Usa, KS, 66045","Multi-Language","Theater"
"LATOMUS","0023-8856","2294-4427","PEETERS","BONDGENOTENLAAN 153, LEUVEN, BELGIUM, B-3000","Multi-Language","Classics"
"LAVAL THEOLOGIQUE ET PHILOSOPHIQUE","0023-9054","1703-8804","UNIV LAVAL","DEPT LITTERATURES, QUEBEC CITY, CANADA, QUEBEC, G1V 0A6","Multi-Language","Philosophy | Religion"
"LAW AND HISTORY REVIEW","0738-2480","1939-9022","CAMBRIDGE UNIV PRESS","32 AVENUE OF THE AMERICAS, NEW YORK, USA, NY, 10013-2473","English","History"
"LAW & LITERATURE","1535-685X","1541-2601","ROUTLEDGE JOURNALS, TAYLOR & FRANCIS LTD","2-4 PARK SQUARE, MILTON PARK, ABINGDON, ENGLAND, OXON, OX14 4RN","English","Literature"
"LEGACY","0748-4321","0748-4321","UNIV NEBRASKA PRESS","1111 LINCOLN MALL, LINCOLN, USA, NE, 68588-0630","English","Literature, American"
"LEONARDO","0024-094X","1530-9282","MIT PRESS","ONE ROGERS ST, CAMBRIDGE, USA, MA, 02142-1209","English","Art"
"LEONARDO MUSIC JOURNAL","0961-1215","1531-4812","MIT PRESS","ONE ROGERS ST, CAMBRIDGE, USA, MA, 02142-1209","English","Music"
"LETTERE ITALIANE","0024-1334","2035-6315","CASA EDITRICE LEO S OLSCHKI","VIUZZO DEL POZZETTO, 8, FLORENCE, ITALY, I-50126","Italian","Literature, Romance"
"LEVANT","0075-8914","1756-3801","ROUTLEDGE JOURNALS, TAYLOR & FRANCIS LTD","2-4 PARK SQUARE, MILTON PARK, ABINGDON, ENGLAND, OXON, OX14 4RN","English","Archaeology"
"LEVIATHAN-A JOURNAL OF MELVILLE STUDIES","1525-6995","1750-1849","JOHNS HOPKINS UNIV PRESS","JOURNALS PUBLISHING DIVISION, 2715 NORTH CHARLES ST, BALTIMORE, USA, MD, 21218-4363","English","Literature, American"
"LEXIKOS","1684-4904","2224-0039","BURO VAN DIE WAT","PO BOX 245, STELLENBOSCH, SOUTH AFRICA, 7599","English, Afrikaans, Dutch, French, German","Language & Linguistics"
